No;Désignation;Durée;Difficulté
1;Le sentier des vignes. Du vignoble d'Yvorne, long ruban de ceps à flanc de montagne, aux collines étagées des vignes de Lavey-les-Bains, le vieux pays vigneron vous accueille à bras ouverts. Surtout, ne manquez pas, à mi-chemin, de faire une halte au château d'Aigle et d'y déguster quelques-uns des délicieux vins de la région. ;7h45;F
2;Tour des Alpes Vaudoises. Aigle - Leysin - Les Mosses - Château-d'Oex - Les Diablerets - Villars-Gryon - Bex - Aigle.;41h00;M
3;Sentier pédestre partant de Château-d'Oex pour rejoindre le village de Lessoc.;5h45;E
4;Le sentier de l'Arboretum se trouve dans un parc où sont présentées plus de 3'000 espèces d'arbres et arbustes de tous les continents pouvant être acclimatées dans la région. Ces collections aux formes et aux couleurs variées sont intégrées harmonieusement dans le cadre paysager. ;1h00;F
5;Tour du lac Léman;8h45;F
